Protein id	Contig id	Start	Stop	Strand	Element symbol	Element name	Scope	Type	Subtype	Class	Subclass	Method	Target length	Reference sequence length	% Coverage of reference	% Identity to reference	Alignment length	Closest reference accession	Closest reference name	HMM accession	HMM description	Hierarchy node
NA	CABHRX010000022.1	31703	32365	-	vat(F)	streptogramin A O-acetyltransferase Vat(F)	core	AMR	AMR	STREPTOGRAMIN	STREPTOGRAMIN	EXACTX	221	221	100.00	100.00	221	WP_005164767.1	streptogramin A O-acetyltransferase Vat(F)	NA	NA	vat(F)
NA	CABHRX010000206.1	1938	3137	+	tet(H)	tetracycline efflux MFS transporter Tet(H)	core	AMR	AMR	TETRACYCLINE	TETRACYCLINE	EXACTX	400	400	100.00	100.00	400	WP_006248867.1	tetracycline efflux MFS transporter Tet(H)	NA	NA	tet(H)
NA	CABHRX010000214.1	1007	1819	-	sul2	sulfonamide-resistant dihydropteroate synthase Sul2	core	AMR	AMR	SULFONAMIDE	SULFONAMIDE	EXACTX	271	271	100.00	100.00	271	WP_001043260.1	sulfonamide-resistant dihydropteroate synthase Sul2	NA	NA	sul2
NA	CABHRX010000227.1	7027	7908	+	blaA	class A beta-lactamase BlaA	core	AMR	AMR	BETA-LACTAM	BETA-LACTAM	EXACTX	294	294	100.00	100.00	294	WP_005165780.1	class A beta-lactamase BlaA	NA	NA	blaA_Yent
NA	CABHRX010000462.1	575	1360	+	aadA31	ANT(3'')-Ia family aminoglycoside nucleotidyltransferase AadA31	core	AMR	AMR	AMINOGLYCOSIDE	STREPTOMYCIN	EXACTX	262	262	100.00	100.00	262	WP_094963248.1	ANT(3'')-Ia family aminoglycoside nucleotidyltransferase AadA31	NA	NA	aadA31
