Protein id	Contig id	Start	Stop	Strand	Element symbol	Element name	Scope	Type	Subtype	Class	Subclass	Method	Target length	Reference sequence length	% Coverage of reference	% Identity to reference	Alignment length	Closest reference accession	Closest reference name	HMM accession	HMM description	Hierarchy node
NA	CAWMJP010000025.1	4469	5194	+	mef(B)	macrolide efflux MFS transporter Mef(B)	core	AMR	AMR	MACROLIDE	AZITHROMYCIN/ERYTHROMYCIN	PARTIALX	242	409	59.17	99.59	242	WP_032492336.1	macrolide efflux MFS transporter Mef(B)	NA	NA	mef(B)
NA	CAWMJP010000025.1	6958	7746	+	sul3	sulfonamide-resistant dihydropteroate synthase Sul3	core	AMR	AMR	SULFONAMIDE	SULFONAMIDE	EXACTX	263	263	100.00	100.00	263	WP_000034420.1	sulfonamide-resistant dihydropteroate synthase Sul3	NA	NA	sul3
NA	CAWMJP010000025.1	8932	9261	-	qacL	quaternary ammonium compound efflux SMR transporter QacL	core	STRESS	BIOCIDE	QUATERNARY AMMONIUM	QUATERNARY AMMONIUM	EXACTX	110	110	100.00	100.00	110	WP_000800531.1	quaternary ammonium compound efflux SMR transporter QacL	NA	NA	qacL
NA	CAWMJP010000025.1	9434	10222	-	aadA1	ANT(3'')-Ia family aminoglycoside nucleotidyltransferase AadA1	core	AMR	AMR	AMINOGLYCOSIDE	STREPTOMYCIN	EXACTX	263	263	100.00	100.00	263	WP_001206316.1	ANT(3'')-Ia family aminoglycoside nucleotidyltransferase AadA1	NA	NA	aadA1
NA	CAWMJP010000025.1	10318	11574	-	cmlA1	chloramphenicol efflux MFS transporter CmlA1	core	AMR	AMR	PHENICOL	CHLORAMPHENICOL	EXACTX	419	419	100.00	100.00	419	WP_000095725.1	chloramphenicol efflux MFS transporter CmlA1	NA	NA	cmlA1
NA	CAWMJP010000025.1	11839	12627	-	aadA2	ANT(3'')-Ia family aminoglycoside nucleotidyltransferase AadA2	core	AMR	AMR	AMINOGLYCOSIDE	STREPTOMYCIN	EXACTX	263	263	100.00	100.00	263	WP_001261740.1	ANT(3'')-Ia family aminoglycoside nucleotidyltransferase AadA2	NA	NA	aadA2
NA	CAWMJP010000025.1	13392	14231	-	estX-3	macrolide esterase EstX-3	core	AMR	AMR	MACROLIDE	TYLOSIN	ALLELEX	280	280	100.00	100.00	280	WP_001456218.1	macrolide esterase EstX-3	NA	NA	estX-3
NA	CAWMJP010000031.1	49229	49891	-	vat(F)	streptogramin A O-acetyltransferase Vat(F)	core	AMR	AMR	STREPTOGRAMIN	STREPTOGRAMIN	EXACTX	221	221	100.00	100.00	221	WP_005164767.1	streptogramin A O-acetyltransferase Vat(F)	NA	NA	vat(F)
NA	CAWMJP010000061.1	1988	2869	-	blaA	class A beta-lactamase BlaA	core	AMR	AMR	BETA-LACTAM	BETA-LACTAM	BLASTX	294	294	100.00	99.66	294	WP_005165780.1	class A beta-lactamase BlaA	NA	NA	blaA_Yent
