Protein id	Contig id	Start	Stop	Strand	Element symbol	Element name	Scope	Type	Subtype	Class	Subclass	Method	Target length	Reference sequence length	% Coverage of reference	% Identity to reference	Alignment length	Closest reference accession	Closest reference name	HMM accession	HMM description	Hierarchy node
NA	CABHTN010000008.1	23962	24624	-	vat(F)	streptogramin A O-acetyltransferase Vat(F)	core	AMR	AMR	STREPTOGRAMIN	STREPTOGRAMIN	EXACTX	221	221	100.00	100.00	221	WP_005164767.1	streptogramin A O-acetyltransferase Vat(F)	NA	NA	vat(F)
NA	CABHTN010000062.1	397	1170	+	aac(3)-IVa	aminoglycoside N-acetyltransferase AAC(3)-IVa	core	AMR	AMR	AMINOGLYCOSIDE	APRAMYCIN/GENTAMICIN/TOBRAMYCIN	EXACTX	258	258	100.00	100.00	258	WP_001199192.1	aminoglycoside N-acetyltransferase AAC(3)-IVa	NA	NA	aac(3)-IVa
NA	CABHTN010000062.1	1402	2424	+	aph(4)-Ia	aminoglycoside O-phosphotransferase APH(4)-Ia	core	AMR	AMR	AMINOGLYCOSIDE	HYGROMYCIN	EXACTX	341	341	100.00	100.00	341	WP_000742814.1	aminoglycoside O-phosphotransferase APH(4)-Ia	NA	NA	aph(4)-Ia
NA	CABHTN010000062.1	6526	7722	-	tet(A)	tetracycline efflux MFS transporter Tet(A)	core	AMR	AMR	TETRACYCLINE	TETRACYCLINE	EXACTX	399	399	100.00	100.00	399	WP_000804064.1	tetracycline efflux MFS transporter Tet(A)	NA	NA	tet(A)
NA	CABHTN010000062.1	20242	21078	-	sul1	sulfonamide-resistant dihydropteroate synthase Sul1	core	AMR	AMR	SULFONAMIDE	SULFONAMIDE	EXACTX	279	279	100.00	100.00	279	WP_000259031.1	sulfonamide-resistant dihydropteroate synthase Sul1	NA	NA	sul1
NA	CABHTN010000062.1	21075	21419	-	qacEdelta1	quaternary ammonium compound efflux SMR transporter QacE delta 1	core	STRESS	BIOCIDE	QUATERNARY AMMONIUM	QUATERNARY AMMONIUM	ALLELEX	115	115	100.00	100.00	115	WP_000679427.1	quaternary ammonium compound efflux SMR transporter QacE delta 1	NA	NA	qacEdelta1
NA	CABHTN010000062.1	21586	22374	-	aadA25	ANT(3'')-Ia family aminoglycoside nucleotidyltransferase AadA25	core	AMR	AMR	AMINOGLYCOSIDE	STREPTOMYCIN	BLASTX	263	263	100.00	98.48	263	WP_024131607.1	ANT(3'')-Ia family aminoglycoside nucleotidyltransferase AadA25	NA	NA	aadA25
NA	CABHTN010000062.1	22491	22724	-	dfrB1	trimethoprim-resistant dihydrofolate reductase DfrB1	core	AMR	AMR	TRIMETHOPRIM	TRIMETHOPRIM	EXACTX	78	78	100.00	100.00	78	WP_000442373.1	trimethoprim-resistant dihydrofolate reductase DfrB1	NA	NA	dfrB1
