Protein id	Contig id	Start	Stop	Strand	Element symbol	Element name	Scope	Type	Subtype	Class	Subclass	Method	Target length	Reference sequence length	% Coverage of reference	% Identity to reference	Alignment length	Closest reference accession	Closest reference name	HMM accession	HMM description	Hierarchy node
NA	CABHRG010000757.1	2681	3478	-	aph(6)-Id	aminoglycoside O-phosphotransferase APH(6)-Id	core	AMR	AMR	AMINOGLYCOSIDE	STREPTOMYCIN	BLASTX	266	278	95.68	100.00	266	WP_000480968.1	aminoglycoside O-phosphotransferase APH(6)-Id	NA	NA	aph(6)-Id
NA	CABHRG010000757.1	3481	4284	-	aph(3'')-Ib	aminoglycoside O-phosphotransferase APH(3'')-Ib	core	AMR	AMR	AMINOGLYCOSIDE	STREPTOMYCIN	BLASTX	268	267	100.00	99.63	268	WP_001082319.1	aminoglycoside O-phosphotransferase APH(3'')-Ib	NA	NA	aph(3'')-Ib
NA	CABHRG010000904.1	37640	38302	-	vat(F)	streptogramin A O-acetyltransferase Vat(F)	core	AMR	AMR	STREPTOGRAMIN	STREPTOGRAMIN	BLASTX	221	221	100.00	99.55	221	WP_005164767.1	streptogramin A O-acetyltransferase Vat(F)	NA	NA	vat(F)
NA	CABHRG010001323.1	1399	2280	+	blaA	class A beta-lactamase BlaA	core	AMR	AMR	BETA-LACTAM	BETA-LACTAM	EXACTX	294	294	100.00	100.00	294	WP_005165780.1	class A beta-lactamase BlaA	NA	NA	blaA_Yent
NA	CABHRG010001884.1	560	1066	-	sul2	sulfonamide-resistant dihydropteroate synthase Sul2	core	AMR	AMR	SULFONAMIDE	SULFONAMIDE	PARTIAL_CONTIG_ENDX	169	271	62.36	100.00	169	WP_001043260.1	sulfonamide-resistant dihydropteroate synthase Sul2	NA	NA	sul2
