Protein id	Contig id	Start	Stop	Strand	Element symbol	Element name	Scope	Type	Subtype	Class	Subclass	Method	Target length	Reference sequence length	% Coverage of reference	% Identity to reference	Alignment length	Closest reference accession	Closest reference name	HMM accession	HMM description	Hierarchy node
NA	NZ_JANAUU010000013.1	2482	3621	+	blaYRC	YRC family class C beta-lactamase	core	AMR	AMR	BETA-LACTAM	CEPHALOSPORIN	BLASTX	380	383	99.22	100.00	380	WP_168370989.1	class C beta-lactamase YRC-1	NA	NA	blaYRC
NA	NZ_JANAUU010000030.1	3886	4215	+	qacG2	quaternary ammonium compound efflux SMR transporter QacG2	core	STRESS	BIOCIDE	QUATERNARY AMMONIUM	QUATERNARY AMMONIUM	EXACTX	110	110	100.00	100.00	110	WP_071846226.1	quaternary ammonium compound efflux SMR transporter QacG2	NA	NA	qacG2
NA	NZ_JANAUU010000030.1	4749	5093	+	qacEdelta1	quaternary ammonium compound efflux SMR transporter QacE delta 1	core	STRESS	BIOCIDE	QUATERNARY AMMONIUM	QUATERNARY AMMONIUM	ALLELEX	115	115	100.00	100.00	115	WP_000679427.1	quaternary ammonium compound efflux SMR transporter QacE delta 1	NA	NA	qacEdelta1
NA	NZ_JANAUU010000030.1	5090	5926	+	sul1	sulfonamide-resistant dihydropteroate synthase Sul1	core	AMR	AMR	SULFONAMIDE	SULFONAMIDE	EXACTX	279	279	100.00	100.00	279	WP_000259031.1	sulfonamide-resistant dihydropteroate synthase Sul1	NA	NA	sul1
NA	NZ_JANAUU010000058.1	1181	2377	+	tet(A)	tetracycline efflux MFS transporter Tet(A)	core	AMR	AMR	TETRACYCLINE	TETRACYCLINE	EXACTX	399	399	100.00	100.00	399	WP_000804064.1	tetracycline efflux MFS transporter Tet(A)	NA	NA	tet(A)
