Protein id	Contig id	Start	Stop	Strand	Element symbol	Element name	Scope	Type	Subtype	Class	Subclass	Method	Target length	Reference sequence length	% Coverage of reference	% Identity to reference	Alignment length	Closest reference accession	Closest reference name	HMM accession	HMM description	Hierarchy node
NA	NZ_JBBESX010000046.1	35998	36879	+	blaA	class A beta-lactamase BlaA	core	AMR	AMR	BETA-LACTAM	BETA-LACTAM	EXACTX	294	294	100.00	100.00	294	WP_005165780.1	class A beta-lactamase BlaA	NA	NA	blaA_Yent
NA	NZ_JBBESX010000051.1	71	733	+	vat(F)	streptogramin A O-acetyltransferase Vat(F)	core	AMR	AMR	STREPTOGRAMIN	STREPTOGRAMIN	EXACTX	221	221	100.00	100.00	221	WP_005164767.1	streptogramin A O-acetyltransferase Vat(F)	NA	NA	vat(F)
NA	NZ_JBBESX010000069.1	10482	11318	-	sul1	sulfonamide-resistant dihydropteroate synthase Sul1	core	AMR	AMR	SULFONAMIDE	SULFONAMIDE	EXACTX	279	279	100.00	100.00	279	WP_000259031.1	sulfonamide-resistant dihydropteroate synthase Sul1	NA	NA	sul1
NA	NZ_JBBESX010000069.1	11315	11659	-	qacEdelta1	quaternary ammonium compound efflux SMR transporter QacE delta 1	core	STRESS	BIOCIDE	QUATERNARY AMMONIUM	QUATERNARY AMMONIUM	ALLELEX	115	115	100.00	100.00	115	WP_000679427.1	quaternary ammonium compound efflux SMR transporter QacE delta 1	NA	NA	qacEdelta1
NA	NZ_JBBESX010000069.1	11826	12614	-	aadA12	ANT(3'')-Ia family aminoglycoside nucleotidyltransferase AadA12	core	AMR	AMR	AMINOGLYCOSIDE	STREPTOMYCIN	EXACTX	263	263	100.00	100.00	263	WP_031306504.1	ANT(3'')-Ia family aminoglycoside nucleotidyltransferase AadA12	NA	NA	aadA12
NA	NZ_JBBESX010000122.1	221	877	+	catA1	type A-1 chloramphenicol O-acetyltransferase	core	AMR	AMR	PHENICOL	CHLORAMPHENICOL	EXACTX	219	219	100.00	100.00	219	WP_000412211.1	type A-1 chloramphenicol O-acetyltransferase	NA	NA	catA1
